{
  "$schema": "./brand.schema.json",
  "name": "ui.artbloom",
  "shortName": "artbloom",
  "wordmark": "ui.artbloom",
  "legalEntity": "Artbloom Labs",
  "domain": "ui.artbloom.tech",
  "origin": "https://ui.artbloom.tech",
  "npmPackage": "ui.artbloom",
  "tagline": "The living library of interfaces",
  "description": "Production-ready React templates and animations. Copy the code, run one command, ship it.",
  "email": "hello@shreyashmishra.in",
  "social": {}
}
